{
  "version": 1,
  "product": "D4 Pocket",
  "export_id": "export-d4-pocket",
  "manifest": {
    "app_identity": {"app_id": "d4-pocket-app-11111111111111111111111111111111", "display_name": "D4 Pocket ローカル構成", "target_platform": "windows"},
    "audit_store": {"store_id": "audit-store-example", "chain_status": "new", "inherited": false},
    "settings": {"locale": "ja-JP", "density": "comfortable", "content_visibility": "summary"},
    "runtime_manifest": {"runtime_ids": ["gui_shell_rust_broker"]},
    "adapter_configuration": {"agent_ids": ["codex"], "tool_ids": [], "mcp_connection_ids": []},
    "capability_requirements": ["agent.metadata", "runtime.read"],
    "distribution_metadata": {"target_platform": "windows", "artifact_status": "not_built", "installer_status": "not_started", "signed": false, "channel": "local"},
    "inheritance_policy": {"authority": "none", "permission": "none", "approval": "none", "credential": "none", "audit_chain": "none"},
    "module_plan": {
      "catalog_version": 1,
      "selection_mode": "explicit_optional",
      "requested_optional_module_ids": ["shell.trace_inspector"],
      "unprunable_core_ids": ["core.security_broker", "core.cryptography", "core.audit_finality", "core.credentials", "core.os_controls", "core.permission_enforcement", "core.approval_enforcement", "core.content_exposure"],
      "mandatory_module_ids": ["shell.dashboard", "shell.runtime_operation", "shell.agent_operation", "shell.authority", "shell.approval", "shell.audit", "shell.recovery", "shell.problems", "shell.evidence", "shell.settings"],
      "included_module_ids": ["core.security_broker", "core.cryptography", "core.audit_finality", "core.credentials", "core.os_controls", "core.permission_enforcement", "core.approval_enforcement", "core.content_exposure", "shell.dashboard", "shell.runtime_operation", "shell.agent_operation", "shell.authority", "shell.approval", "shell.audit", "shell.recovery", "shell.problems", "shell.evidence", "shell.settings", "shell.observability", "shell.trace_inspector"],
      "excluded_optional_module_ids": ["shell.setup_doctor", "shell.history", "shell.evaluation_lab", "shell.host_capabilities", "shell.notifications", "shell.host_operations"],
      "binary_pruning_status": "not_applied"
    }
  }
}
